,context,question,answerA,answerB,answerC,label
1188,Remy made a huge difference in the season and was crowned the MVP of the league.,What will Remy want to do next?,rest on laurels,accept praise,retire early,2
1189,Aubrey asked Tracy a question about the project because they weren't in class the day it was talked about.,Why did Aubrey do this?,learn more,double check to ensure it was correct,get a good grade on it,1
1190,Quinn brought forth the prisoners to face their accusers in court.,How would Others feel as a result?,obligated to do it,angry at the justice system,happy to do it,1
1191,"Riley was always a strict librarian, he gave no one access to the restricted section.",How would Riley feel afterwards?,loved following the rules and felt happy,hated following rules,felt bad about the job he'd done,1
1192,Quinn bought Alex's flowers that day and got a big hug because of this act.,How would Alex feel as a result?,detached,loved,lazy,2
1193,Robin acted as Quinn's intermediary in the situation so that things would go smoothly.,How would Quinn feel as a result?,thankful,as kind,as helpful,1
1194,Tracy was at work and they needed to get things done so she obeyed Skylar's orders.,How would Tracy feel afterwards?,practical,diligent,Like they were doing their job,1
1195,Remy spent any money they had on groceries for dinner.,Why did Remy do this?,did this for revenge,did this to make dinner,go to the store,2
1196,Jordan brought the ball to Sasha's end so Sasha didn't have to go all the way to the other end to get the ball.,How would Sasha feel as a result?,appreciative,frustrated,annoyed,1
1197,Jesse received many different stories in the contest and Jesse published every story.,What does Jesse need to do before this?,publish new stories,Write books,Have a contest,3
1198,Casey gave Alex aid from the wound he received that day.,How would Alex feel as a result?,loved,lazy,bored,1
1199,"Cameron had lived such a short life and endured so much suffering, but the illness had finally taken their life, and now Cameron was gone forever.",How would Others feel as a result?,someone who has finally found peace,a fighter until the end,emotional,3
1200,Kendall made Casey apply at every store in the entire mall.,What does Kendall need to do before this?,make sure Casey got a job,pay nothing,pay rent,1
1201,Quinn asked Austin to describe the painting in detail so he could file a police report.,What will happen to Austin?,sell his art,complete a painting,answer questions,3
1202,"Remy talked about themselves for hours on end, exhausting everyone else.",What does Remy need to do before this?,talk about their vacation,tell every detail about the trip,be around other people,3
1203,Addison returned to their car after leaving the office.,How would Addison feel afterwards?,as ambitous,they are finished at the office,they need to go home,3
1204,Tracy smelled like Bailey which was a comforting smell for her.,How would Bailey feel as a result?,bitter,angry,relaxed,3
1205,Tracy gathered Remy's things up that were left in the library.,What will Remy want to do next?,give them to Remy,tell Tracy to get lost,meet up with Tracy,3
1206,Skylar was at the pier fishing off the dock. Skylar caught anything while they were fishing.,Why did Skylar do that?,bait the hook,catch more fish,wanted to have fun,3
1207,"Bailey's game of tennis did not go well, they lost every match.",How would you describe Bailey?,not a very good tennis player,a champion tennis player,a professional tennis player,1
1208,Ash decided to let loose and threw everything to the wind.,How would Ash feel afterwards?,reckless,did not make a cautious decision,a weight lifted,1
1209,Kai put the eggs in the bowl and put the bowl in the fridge for a few days.,Why did Kai do this?,lazy,close the door,prepared,3
1210,Robin took the paper back to the counter to pick up her order.,Why did Robin do this?,did this to cause trouble,did this to get her order,leave with the order,2
1211,Jordan got on one knee and gave her an engagement ring.,Why did Jordan do this?,clean her fingernails,check her ring size,get married to her,3
1212,Kendall purchased clothes online for an upcoming vacation.,What will Kendall want to do next?,borrow clothes from friends,try on the new clothes,wear old clothing,2
1213,Robin cleaned the house after they threw a big party one day.,How would you describe Robin?,a cold person,a clean person,a mean person,2
1214,Quinn had money to go shopping and spent the money quickly.,What will Quinn want to do next?,call out sick,appreciate what they have,go to the ATM,2
1215,Remy invited friends over and made a small party without  his parents permission last weeknend. Remy parents punished him for a week.,What will happen to Remy?,be punished for life,in trouble,badly for Remy,2
1216,Addison held meetings for years and got a lot of money from the decisions.,What will Addison want to do next?,lazy,proud,bored,2
1217,Remy invited all of his friends over.  It was their birthday.,What will happen to Others?,eat food,be bored,have a good time,3
1218,Jordan produced some boxes of cookies that were always in high demand annually.,What will Others want to do next?,Others will begin to return the cookies since they were bad,Other people will place orders for Jordan's cookies,make more cookies to make more money,2
1219,Robin was in search of a new car and saw one she liked. Quinn gave Robin an estimate of the car.,Why did Quinn do this?,ignore Robin and seek others,Negotiate the price for a deal,help Robin with her budget,3
1220,Lee was trying to win a race. Lee watched to make sure they did not run into anyone.,Why did Lee do this?,wanted to win,run faster than anyone,was afraid of the runners,1
1221,Aubrey was playing football with their friends and fell on her feet while playing.,What will happen to Aubrey?,bad for Aubrey,pain,have fun,2
1222,Lee and Carson had been online friends for a year. Lee met Carson in person.,How would Lee feel afterwards?,normal,typical,unusual,3
1223,Kai always played ball to burn calories after lunch.,Why did Kai do this?,become a star soccer player,get more practice in,lose some weight,3
1224,Jordan really helped Skylar study when he was studying for the big test.,How would you describe Jordan?,appreciative,a tutor for Skylar,confident,2
1225,Ash cut a wide swath in the argument with their superior mastery of the language.,What does Ash need to do before this?,get involved in the movie,have a good grasp of mathematics,get involved in the discussion,3
1226,Robin gave the beggar money and offered her moral support.,What will Robin want to do next?,help someone else next,Because Robin was a kind person,get paid next,1
1227,Robin called his daughter and told her how much he loved her.,How would Others feel as a result?,proud of their daughter,Others would be thankful for Robin's call,glad to be a father,2
1228,Taylor made Kai attack the army. The orders came down from the company commander.,What will Kai want to do next?,wanted to end the war,get proper equipment,wanted to win the war,3
1229,Jesse was always open and honest with his friend's so he would always tell Kendall anything she wanted to know.,How would you describe Jesse?,an honest person with his friends,tell Jesse her secrets,appreciate Jesse trusting her,1
1230,Remy leaves on their vacation relaxed and ready for a great time.,Why did Remy do this?,work overtime,book a vacation,create fun memories,3
1231,Bailey had a plan to reconnect with the buyer. Bailey would return next week.,How would you describe Bailey?,someone who prefers manual labor,someone with good social skills,someone who prefers manual work,2
1232,Remy rubbed Tracy's hurt thumb after they closed it in a car door.,What will happen to Tracy?,better,guilty about hurting Tracy,go to a doctor,3
1233,Riley gave a birthday card to her friend that had ten dollars in it.,What will Riley want to do next?,give Riley a hug,thank Riley,see their friends reaction,3
1234,Jesse asked friends for suggestions on which dog to get.,What will happen to Jesse?,advise Jesse,picks a cat,picking what friends suggest,3
1235,Addison checked Skylar's car after driving it and felt bad for damaging it.,What will Addison want to do next?,considerate,hide the car from Skylar,Apologize to Skylar,3
1236,Taylor raised chickens and Sydney had an issue with that.,How would Sydney feel as a result?,unconventional,like quarreling neighbors,like they work together,2
1237,Aubrey got a beautiful doll for their birthday present.  Aubrey loved the doll very much and was a very happy child.,What will Aubrey want to do next?,bring the doll everywhere with her,hide the doll and not show to family and friends,leave the doll behind and not bring it anywhere,1
1238,Jesse ruled okay for such a worshipped king.,How would you describe Jesse?,sort of lazy,Very commanding,bold,1
1239,Remy asked Jordan to dinner for the third time that night.,Why did Remy do this?,Figure out a way to politely decline,was hungry,Finally accept his friend's invitation,2
1240,"Even though he knew the play was very important to his wife, for Austin it was extremely boring and he did not want to go there.",How would Austin feel afterwards?,honest with himself,Excited to go to another play soon with his wife,Like he did something nice for his wife,3
1241,Robin told Kendall that she wanted to go out with Kendall's brother and go to the dance with him.,How would Robin feel afterwards?,mean and sad,very brave,she wanted to go out with Kendall,2
1242,Carson told Cameron's sister the news that Cameron was pregnant.,What will Cameron want to do next?,pick a name,smoke a cigarette,drink alcohol,1
1243,Jesse filled Aubrey's glass with wine during the weekly dinner party.,What will Jesse want to do next?,pour milk into the glass,spill wine on the floor,offer wine to the others,3
1244,"Since the charity was almost drawing to a close, Riley persuaded them to give generously for the rest of the night.",What will Riley want to do next?,thank all of the donators,needed to plead the case,needed to explain the cause,1
1245,Jan would play chess every day in order to prepare for the compettion.,What does Jan need to do before this?,she wanted practice,needed to get inspiration,she wanted victory,2
1246,"Cameron could give birth any day now, so to be a good partner, Casey prepared for Cameron's emergency.",What does Casey need to do before this?,dislike Cameron,pack the hospital bag,want to help Cameron,3
1247,"Casey has always loved to eat tacos, it's her favorite food.",What will Casey want to do next?,she liked to eat,she loved tacos,eat tacos,3
1248,Remy leaned in for a kiss as Quinn blinked their eyes. Remy kissed Quinn.,What will Quinn want to do next?,walk away,find someone else to kiss,kiss Remy back,3
1249,Addison worked into a department store where Skylar worked as the manager.  A customer had a complaint and wanted to speak directly to the store manager.,What will Skylar do now?,address the issues,work on her customer service,ignore the customer,1
1250,Bailey used her charisma to control the unruly situation.,What will happen to Bailey?,be satisfied,be upset,useless,1
1251,Casey got another drink at the bar and then walked home for the night.,Why did Casey do this?,bored,Crawl into bed,loved,2
1252,Austin for for Quinn's life and was exhausted afterward.,What will Austin want to do next?,eat next,recooperate next,be at leisure,2
1253,Carson found Aubrey's bike in the Garage and asked Aubrey if they could ride it.,How would Carson feel afterwards?,Hopeful to ride the bike,Like they should buy the bike,Carson found Aubrey's bike in,1
1254,"Jesse was a horrible student, so Jesse stopped going to school.",Why did Jesse do this?,go to a great college,get their GED instead,stay out of school,3
1255,Skylar called someone to ask if they would be able to borrow some money.,What will Skylar want to do before that?,figure out how much to ask for,have someone loan them some money,decide not to call,1
1256,Austin did not bring a bike. Austin rode Jesse's bike.,How would Austin feel afterwards?,unaware,thrifty,indebted,3
1257,"It was halloween and Taylor was waiting by the door to give out candy. When Carson came, Taylor gave them a treat.",Why did Taylor do this?,said kids are too loud,close the door,enjoyed halloween,3
1258,Kendall walked to school one time and got there a little early that day.,How would Kendall feel afterwards?,conflicted,lazy,smart,3
1259,Jesse went to get married to his girlfriend that he had been with for years.,How would Jesse feel afterwards?,angry,excited,hurt,2
1260,Addison played very well with the kids from down the street.,How would you describe Addison?,friendly,antisocial,antagonistic,1
1261,Jesse did not like to joke around so Jesse played Sasha no tricks in their life.,How would Jesse feel afterwards?,Neutral,a serious person,Sneaky,2
1262,Cameron brought their family to his play. They were so excited to see him act.,What does Cameron need to do before this?,practice their lines,forget their lines,fulfill their wishes,1
1263,Cameron studied karate for years and liked learning discipline and effort from it.,What will Cameron want to do next?,ask to study,learn discipline,keep studying,3
1264,Carson wanted to be a photographer and took plenty of photos for practice.,What does Carson need to do before this?,Invest in a darkroom,buy the right equipment,buy some painting equipment,2
1265,Sasha summoned another demon in her dream and was having trouble sleeping.,How would Sasha feel afterwards?,refreshed and invigorated,foggy and sleepy,like a dragon slayer,2
1266,Jesse got it checked out after finding out that it may be trouble.,How would Jesse feel afterwards?,great,horrible,smart,2
1267,Cameron put Tracy's arm around Cameron's neck. They are having a romantic walk.,What will Tracy want to do next?,kiss Cameron's lips,closer to Tracy,walk away from Cameron,1
1268,Ash diagnosed the patient with diabetes quickly and helped them get on track.,How would Ash feel afterwards?,capable and proud,unsure and hesitant,worried and concerned,1
1269,Carson wanted to add some shade so he planted a tree in Kendall's backyard.,What will happen to Carson?,be ignored by Kendall,be thanked by Kendall,have to rake in the fall,2
1270,Jan made the decision to hire the best candidate for the job.,What does Jan need to do before this?,Hire someone without an interview,most qualified,Ignore the candidates qualifications,2
1271,Robin wanted to make an appeal to the judge. Tracy gave Robin a hearing.,How would you describe Tracy?,divisive,dismissive,smart,1
1272,Casey got contact lenses after visiting the eye doctor last week.,What will Casey want to do next?,had trouble seeing road signs while driving,keep an extra pair of contacts handy,ignore the eye doctor's recommendation,2
1273,Austin has type 1 diabetes and has just realised that they have a hypo so Austin knew what to eat to help bring their blood sugars up.,What does Austin need to do before this?,better,learn about the sugars or carbs in foods,not learn about diabetes,2
1274,"After having too much to drink at the bar, Casey crashed into a ditch.",What does Casey need to do before this?,have a bunch of drinks,sober up,go out to the shed,1
1275,Getting to work late every day was something Skylar was warned about so they finally got fired.,How would Skylar feel afterwards?,good,happy that no work,upset the job was lost,3
1276,Addison went on a date with a friend she had for a very long time.,Why did Addison do this?,hurt a person,get free food,find true love,3
1277,"Sydney told Baily's grandma about the death of her grand daughter Baily, tears started to flow out of her eyes.",How would Sydney feel afterwards?,relieved,would be happy and would move on,a hole inside,3
1278,"After breaking up after a 5 year relationship, for the first time in a long time, Skylar lived without Quinn.",What does Skylar need to do before this?,lived without Quinn,Break up with Quinn,Get a new girlfriend,2
1279,"Jan had always wanted a puppy, but decided to adopt an older shelter dog instead.",How would you describe Jan?,free-spirited,outgoing,compassionate,3
1280,Riley struck fear into their hearts by bringing a knife and a scary clown mask.,Why did Riley do this?,scared,buy a scary clown mask,buy a knife,1
1281,Sasha went all the way back home to the their glove for the baseball game.,What will Sasha want to do next?,go back to the soccer field,have forgotten their glove,arrive in time for the game,3
1282,Austin came home from the war and eagerly wanted to see their loved ones.,What will the loved ones want to do next?,send Austin off to war,celebrate Austin's return,go to war,2
1283,Robin decided to bake cookies for his friends today.,Why did Robin do this?,bring the cookies to their friends,package the cookies to give out,wanted to impress his friends,3
1284,"Remy grew flowers, onions, corn and peppers in their back garden.",What does Remy need to do before this?,fertilize the soil,sell vegetables,sell flowers,1
1285,Taylor's family had a dog and Taylor loved the dog also.,How would Taylor feel afterwards?,a pet owner,Glad to talk about a pet,good for having a dog,3
1286,"After finding out that he failed his final exam, Austin left in a huff of rage.",How would Others feel after?,happy for Austin,excited for Austin,sorry for Austin,3
1287,Kendall went halfsies with his friend on a large two topping pizza.,How would Others feel as a result?,fulfilled in pizza autonomy,hungry,sick,2
1288,Taylor listed the plot for sale and finally sold Jordan's land.,How would you describe Taylor?,relieved to have sold it,good at his job,bad at his work,1
1289,Addison got good grades on all of their hard tests at the end of the school year.,What does Addison need to do before this?,got good grades because they studied a lot,study a lot,got good grades because they were intelligent,2
1290,Ash let their friend off with a warning. It was clear it could not happen again.,How would Ash feel afterwards?,a bad person,a selfish person,a good person,3
1291,Skylar decided to buy soda instead of having a fruit drink.,How would Skylar feel afterwards?,Thirsty,spontaneous,indulgent,3
1292,cameron was the new basketball coach so he divided the teams into classes.,What will happen to Others?,be upset,be excited,be nervous,2
1293,Taylor completed his education and became a well-known surgeon at a hospital.,How would Taylor feel afterwards?,like an incompetent person,like he wasted his life,like a proud person,3
1294,Sasha laughed in their sleeve to hide their face. Sasha didn't want anyone to see.,How would Sasha feel afterwards?,a good friend,As someone who didn't want to make a scene,a bad friend,2
1295,Skylar told lee to bring drinks to the party for everyone attending.,What will Lee want to do next?,buy sodas for everyone,remind Lee to bring drinks for the guests,complain,1
1296,The others were throwing a party and really wanted Carson to come.,What will Others want to do next?,forget to invite Carson,refuse to let Carson come to the party,offer Carson a ride to the party,3
1297,Kendall went to the store to get some items so they could fix the sink.,What will Others want to do next?,find a girlfriend,pick the right items,fix the sink,3
1298,Addison took Tracy's blood pressure and pulse because Tracy was nervous.,What will Addison do next?,happy to help stop Tracy from being nervous,give Tracy an Ativan,relieved to know that nothing wrong with Tracy,3
1299,Remy gave Addison a glass of his best whiskey cocktail: a good old fashioned.,What does Remy need to do before this?,drink the cocktail,make the whiskey,make a drink for Addison,3
1300,Tracy learned to play the violin and eventually was invited to perform at an elite concert.,How would Tracy feel afterwards?,appreciated,successful,like a fraud,2
1301,Tracy checked under Austin's bed after they complained about having nightmares.,What will Austin want to do next?,be a confidant of Austin,be scared,go back to sleep,3
1302,Jesse took his first steps and getting a good Job.,What will Jesse want to do next?,do his work well,talk good about work,make good money,1
1303,Aubrey ran everyday to prepare for the marathon coming up.,How would you describe Aubrey?,excited to complete the race,lazy,hard working,3
1304,Tracy found Kendall snooping around Tracy's stuff in her room at home.,How would you describe Tracy when finding Kendall?,feeling like an invasion of privacy,willing to take Kendall out to dinner,okay with Kendall snooping around her stuff,1
1305,Sasha bought several dresses from difference stores for the big dance that was coming up.,How would Sasha feel afterwards?,indecisive,happy,upset,1
1306,Robin asked Remy for Alex's number. Alex didn´t want to talk to Remy and asked who had given Remy his number.,What will happen to Robin?,embarrassed,ashamed,be in trouble with Alex,3
1307,Jan asked Riley not to tell anyone about their relationship and Riley reluctantly complied with these wishes.,How would Riley feel afterwards?,happy with him,like he's not good enough,happy to be a secret,2
1308,Jesse's brother kept making fun of him until Jesse blew up and hit him in the face.,How would the brother feel as a result?,like hitting Jesse back,laughing from joy,disappointed in themselves,1
1309,Remy bought concert tickets so she could go see the band perform live.,Why did Remy do this?,go inside,spend time alone,see her favorite band,3
1310,Kendall performed the speech on their behalf so that they would know all the information.,What does Kendall need to do before this?,be thanked for their performance,leave them behind,talk with them,3
1311,Sydney made it special for them in honor of their twentieth wedding anniversary.,Why did Sydney do this?,did this as a gift,did this in spite of the divorce,did this as an insult,1
1312,"Jan paid Sasha to do some housekeeping, so Sasha was cleaning Jan's room.",What will Sasha want to do next?,make a mess in the room,clean the rest of the house,pay Jan for the work,2
1313,Cameron headed toward Robin with his fists clenched.,How would Robin feel as a result?,ready to fight,challenged,sad,2
1314,jordan tried on his suit and addison said it needed adjusted.,How would Jordan feel about that?,like helping Jordan adjust it,like disowning addison,grateful to addison,3
1315,Addison was careful to hear Addison's ideas and put them in to action.,How would Kendall feel as a result?,taken advantage of,valued,tricked,2
1316,"Riley forced Jan to enter the room so that everyone could yell ""surprise"" for her birthday.",What will Jan want to do next?,go in,surprise her,celebrate with her,3
1317,Cameron told Jesse's friends about it so they would know too.,What will happen to Jesse?,they won't know,they will know him,he will be ignored,2
1318,Alex was in a wrestling tournament and defeated every opponent.,How would Alex feel afterwards?,they won,like failures,they dominated,3
1319,"Cameron slit his thumb on a blade, and then sewed the wound together.",How would you describe Cameron?,quite a bleeder,hurting himself more,a nurse,3
1320,"Alex was so cold that he had turned blue, but luckily it was time to go inside.",How would Alex feel afterwards?,fragile,cold,warm and cozy,3
1321,"Sydney was frying bacon in Casey's apartment, and Sydney sounded Casey's fire alarm.",What will happen to Casey?,turn off the stove,get out of the apartment,call the fire department,1
1322,Sydney knew right away that the displayed artwork hanging in the museum was a fake.,How would you describe Sydney?,mad now,an appraiser with a good eye,sad now,2
1323,Addison found Casey's watch around the corner at the store after it had been missing for days.,What will Casey want to do after?,give the watch to the clerk,wear the watch,throw it away,2
1324,Carson read Jan's letter and sent one back to her.,What will Jan want to do next?,burn Carson's letter,ignore Carson forever,open her letter,3
1325,Skylar raised Jan's hackles when she stole his car.,What will Skylar want to do next to Skylar?,give the car to Skylar,sell the car to Skylar,report her to the police,3
1326,Robin went camping with their friend Cameron and showed them a good time.,What will Robin want to do next?,roast some marshmallows,skip the camping,go home,1
1327,Taylor asked Tom to go to the dance.,How would Others feel as a result?,happy,Nervous,scared,1
1328,Sasha took him to Vegas after he told her it was his dream to go.,How would you describe Sasha?,selfish,caring,uncaring,2
1329,Alex sleeps through their alarm and wakes up an hour late for work. Alex is panicking because they have been late several times and are on thin ice.,What will Alex want to do next?,go back to sleep as it's not a big deal,decide to stay home for the day,quickly get dressed and leave,3
1330,sydney was not in a good mood so she made tracy tell her what she knows.,What will happen to Sydney?,ignore Sydney,make tracy give her the answers she wants,leave Sydney alone,2
1331,Cameron ate Italian food and found out some of the meat was spoiled.,How would Cameron feel afterwards?,disgusted that they had eaten it,healthy,sick,1
1332,Remy got home from school and decided to go bike riding.,Why did Remy do this?,Study for his test,Get some exercise,check that he has a bike helmet,2
1333,kendall after much persistence finally got a date with bailey on saturday.,How would Bailey feel as a result?,very persistent,as annoyed,as delighted,2
1334,Sasha asked for Sydney's advice on how to build a fence in her back yard.,What will happen to Sydney?,have their advice ignored,not answer their phone,be taken to the hardware store,3
1335,"Looking to shoot the bird down from the sky, Ash pulled the trigger of the shotgun.",What will Ash want to do next?,go to the forest,return home,see if the shot hit,3
1336,Jan went home and changed and then met everyone for dinner.,How would Jan feel afterwards?,social afterwards,reliable,isolated afterwards,1
