,context,question,answerA,answerB,answerC,label
2366,Addison layered Casey's hair when they asked for a new type of haircut.,What does Addison need to do before layering the hair?,shave off the hair,give a sample look of the style,cut more peoples hair,2
2367,Addison put her tooth under her pillow after her mom told her what to do.,What will Addison want to do next?,forget about it,lose a tooth,wait to see what´s going to happen,3
2368,"Riley walked toward the house and kept their hands loosely at their sides, ready for any sudden movement.",What will Riley want to do next?,be on guard just in case,knock on the front door,be prepared for an attack,1
2369,Robin set a goal to run five miles every day.,How would you describe Robin?,dedicated to meeting goals,a lazy person,dedicated to ignoring goals,1
2370,Bailey served their ends that they have been wanting to do for a while.,How would Bailey feel afterwards?,very dumb,Hard to understand,very relieved,3
2371,Tracy afforded Bailey the opportunity to get a raise by putting in some overtime.,What will happen to Tracy?,be shunned by Bailey,put in lots of overtime,get a bunch of extra work from Bailey,3
2372,Remy posted flyers to the event they were going to put on.,Why did Remy do this?,So people would know about the event,So people would go to the flyers,make new ones,1
2373,Tracy just listed Skylar for sale on the school's community website.,Why did Tracy do this?,lose money,be good at writing fake ads,have Skylar annoy someone else,3
2374,Quinn bought medicine without a prescription but didn't get any better so he called the doctor.,What will Quinn want to do next?,wanted the correct medicine,have a party next,be treated next,1
2375,addison was begged by a homeless man so addison gave him money.,How would you describe Addison?,as generous,as mean,as selfish,1
2376,Ash was convinced Taylor would be fine in the big play this coming Friday.,Why did Ash do this?,see Taylor in the play,bored,great,1
2377,Tracy was leaving on an important business trip. Addison took Tracy to the airport that day.,How would you describe Addison?,a anxious person,a nice person,thankful for Tracy,2
2378,Robin loved playing the piano and decided to take classes at her local community classes.,How would you describe Robin?,very untalented,very bad at music,very talented,3
2379,Taylor improved the patient's mindset about the extraction by telling them they are fully covered by insurance.,How would the patient feel as a result?,calm down,kind,start to panic,1
2380,tracy loved studying so she always did well in private school.,How would you describe Tracy?,as lazy,as ambitious,as stupid,2
2381,"Cameron had no money but was really hungry, so he persuaded the cook to give him a sandwich for free.",How would Others feel as a result?,That Cameron took advantage of the cook,That the cook hated Cameron,That Cameron paid for the sandwich,1
2382,Skylar helped the people to understand what was happening in the politics at home.,How would Others feel as a result?,happy with Skylar,mean to Skylar,hurtful to Skylar,1
2383,Carson recently had a baby and their friend Tracy is coming to visit.,What will happen to Carson?,embarrassed,uncomfortable,pleased,3
2384,Sydney kissed Bailey's forehead when they were sitting together.,What will happen to Sydney?,sad,close to Sydney,wipe off the kiss,2
2385,Carson got all the ingredients for dinner but still needed to preheat the oven and prepare some other things.,What will Carson want to do next?,feed others,avoid the final preparations,preheat the oven,3
2386,Kendall told Casey's kids that he would be back before they knew it.,What will Kendall want to do next?,ask why they never visited,write letters to the kids,forget about the kids,2
2387,Jan pulled Kendall's hands because they just had a serious argument.,Why did Jan do this?,pull away,get Kendall's attention,shove her,2
2388,Taylor made Tracy an offer. It was quite tempting. Too tempting.,How would Tracy feel as a result?,nothing was amiss,they were foolish,something was up,3
2389,Riley gave Quinn a view of the city from his high condo.,What will happen to Riley?,generous,he will jump off,won't have friends,1
2390,Taylor showed Casey the path because she wanted Casey to succeed.,How would you describe Taylor?,like they want to repay Taylor,cruel,kind,3
2391,ash went to harvard to be a lawyer and did well for himself.,How would Ash feel afterwards?,accomplished,like a failure,lazy,1
2392,Remy put makeup on Lee's face and then they woke up.,What will happen to Remy?,go back to bed,fall asleep,start talking,3
2393,Kai wanted to take Jan outside to play. Kai played fetch with Jan in the backyard.,Why did Kai do this?,take Jan back inside,go back inside,wanted to be active,3
2394,Cameron gave Casey a drink from the open bar.,Why did Cameron do this?,be a bad influence,give a bad message,show care,3
2395,Carson was out looking for a bug for his collection. Carson thought he could find it by the river.,What will Carson want to do next?,give up searching,wanted to find a bug for his collection,search for it,3
2396,Cameron went to the store and bought some bread so they could make toast.,How would Others feel as a result?,a little hungry,want to eat some bread,very sad,2
2397,Austin was nervous about the test but Austin completed the test successfully.,How would Austin feel afterwards?,nervous,Nervous,Relieved,3
2398,Lee had their driving test coming up so Lee booked more lessons and practiced harder.,What does Lee need to do before this?,book their driving test,cancel their driving test,lose their provisional license,1
2399,Addison was looking through the newspaper and saw an ad for a car.,What will Addison want to do next?,create a car budget,call the number,burn the paper,2
2400,We bought concert tickets for Remy's birthday to see the NSYNC reunion on stage.,Why did Lee do this?,meet the band,'s caring,likes NSYNC,3
2401,Jordan found Jan's keys out back stuck behind a large bush.,How would Jan feel as a result?,pleased with themselves,embarrassed,happy to have helped their friend,1
2402,Taylor granted her daughter Riley permission to dance and Riley did so well she impressed everyone watching.,How would Taylor feel afterwards?,felt angry,felt entertained,was enraged,2
2403,Addison ran past Jan when they had the ball to try and score some points.,How would you describe Addison?,earn points,very fast,As someone who threw the ball,2
2404,Quinn wanted to help me clean my room up because it was so messy.,What will Quinn want to do next?,Eat messy snacks,help out a friend,Pick up the dirty clothes,3
2405,Sasha determined Aubreys costomer base was young and it didnt work for the purposes of the company.,How would Aubrey feel as a result?,terrible all that hard work to the trash,happy and proud about her work,smart,1
2406,Jordan rested her fingers on Riley's hands as she looked into his eyes.,Why did Jordan do this?,create a connection with Riley,pull a hand away from Jordan,kiss Jordan,1
2407,Quinn spent a lot of time with the Kai family. The family was always good to them.,What will happen to Kai?,set a bad example,set a good example,be a bad person,2
2408,Aubrey left the classroom to get some more crayons for the art project.,How would you describe Aubrey?,feeling skilled,happy to continue working on the art project,feeling bored,2
2409,Bailey visited family this weekend and was on their way home.,What will happen to Bailey?,go home,get back to there family,Others remained at home,1
2410,The new game that Sasha was programming had taken a lot of effort on her part so she was happy with the results when she finished.,How would you describe Sasha?,uninspired and lazy at work,does incomplete and inaccurate work,a hard worker and diligent,3
2411,Casey wanted to relax after work. Casey got a bath started and made some tea.,How would you describe Casey?,a person who values taking time to rest,a person who hates relaxing,be stressed,1
2412,Tracy let Alex go first when they arrived at the roller coaster park.,How would Tracy feel afterwards?,"considerate, so they let Alex get in line first","patient, so they let Alex get in line first",giving,1
2413,Taylor ran faster in the race and kept trying to do their best.,What does Taylor need to do before this?,enter another competition,take a rest,want to go faster,1
2414,Quinn was crying because other students made fun of his hair color. Lee gently raised Quinn's head up high with smile.,How would Quinn feel as a result?,valiant and fearless,angry against Lee,angry that Quinn was teased,1
2415,Taylor was having a bad day until she did her favorite hobby: singing and playing guitar.,How would Skylar feel afterwards?,start crying,happier,a singer and guitarist,2
2416,Sasha asked Lee's mom for her number so that she could stay in contact with Lee.,How would Lee feel as a result?,pleased with what they did,wanted,happy to have a way to contact Lee,3
2417,Quinn's sister just had a baby. Quinn came every week to help out when needed.,How would you describe Quinn?,a caring person,a mean person,a selfish person,1
2418,Riley threw away the scraps that were left over from dinner.,What does Riley need to do before this?,gather all of the trash,feed the scraps to the dog,wash the dishes by hands,1
2419,Remy spent the day writing the outline for the sequel to her book.,How would you describe Remy?,a hard worker,tired out from the hard work,not a hardworker,1
2420,Sasha caught Tracy off guard when she entered the room unannounced.,How would Sasha feel afterwards?,a stealth person,apologetic afterwards,very sneaky,2
2421,Jesse looked the part in the play they were putting on.,How would you describe Jesse?,accomplished,As someone prepared for the play,glad,2
2422,Bailey fended everyone off and had to prove that they were right for the job.,How would Bailey feel afterwards?,alone,determined and qualifed,a strong candidate,2
2423,Sasha traced the paper for the material and put it in his bag.,Why did Sasha do this?,was forced to do it,was bored,liked the image and wanted to keep it,3
2424,Kendall finished the long book in a surprisingly short amount of time.,How would Kendall feel afterwards?,angry at themselves,Accomplished,like they hated the book,2
2425,Jan asked Lee what has wrong after he fell down the hill.,What will happen to Lee?,may have sprained his ankle,may have died after falling off a cliff,may have been kidnapped,1
2426,Alex baited his hook with a synthetic lure and threw it into the pond.,Why did Alex do this?,go out for dinner tonight,use up the rest of the live bait,catch a large bass,3
2427,Addison paid it forward and got home to play games on the internet.,What will Others want to do next?,go back and have fun time,lazy,skilled,1
2428,Remy was walking his dog and found a girl in the park.,What will Others want to do next?,Ask him where she was,accuse him of taking her,meet girls,3
2429,Robin started school with her friend and the enjoyed the new classes.,What does Robin need to do before this?,skip school before this,make a friend first,met some great new teachers,2
2430,Jan waved Robin's arms in the air playing a game.,Why did Jan do this?,did this to annoy her,win the game,did this to be playful,3
2431,Addison provided Kendall the answer to the question. It didn't take long to be proven correct.,How would Kendall feel as a result?,successful,like they were stupid,like they knew what was up,1
2432,Sasha entered Kai's house to deliver and install a new dishwasher.,What will Sasha want to do next?,bring in the dishwasher,very helpful,set out the tea,1
2433,"Customary to checkups before cooking in the kitchen, Bailey had her hands out for inspection by the supervisor.",How would Bailey feel afterwards?,angry with the supervisor,disappointed with the regular inspections,happy to pass the checks,3
2434,Casey came home later after spending the night drinking at a bar.,Why did Casey do this?,wanted to go to sleep after drinking,lost track of home,take aspirin,1
2435,Riley expressed Kendall's feelings through poetry which they recited in front of everyone.,What does Riley need to do before this?,listen to Riley's poetry,see everyone's reaction to the poetry,ask Kendall how they felt,3
2436,Sydney didn't know how to play the piano but Addison will teach them.,What will Addison want to do next?,help Sydney,teach Sydney a song on the piano,be a good person,2
2437,Tracy bought a nice piece of jewelry for her new job that was starting.,What will Tracy want to do next?,pay for the jewelry,steal the jewelry,buy a pretzel,1
2438,Jane's profession requires her to work closely with clients. Jane is very artistic and enjoys drawing. Jane's job requires her to draw pictures directly on her clients skin.,What type of job does Jane have?,creative,a tattoo artist,Jane works at the front desk,2
2439,"Even though Robin spend the day goofing around, Robin seemed to work hard.",How would Robin feel afterwards?,ambitious,relaxed,like they are getting an unfair deal,2
2440,Taylor derived their opinion from the fact that they were usually correct in their assessments.,What will Taylor want to do next?,not listen to their intuition,not share their opinion,listen to their intuition,3
2441,"Jesse could have gone with the Others camping, but instead played video games with their friends.",What will happen to Others?,play video games with Jesse,go on camping without Jesse,have fun playing games,2
2442,"After working together for three months on a project at work, Sasha finally became Casey's friend.",How would you describe Sasha?,an annoying coworker,a friendly employee,a rude employee,2
2443,Tracy took Casey's car because her's was in the shop getting repaired.,Why did Tracy do this?,drive in a better car,have a reliable way to get to work,ask Casey if she could borrow the car,2
2444,"Since Sasha's mom had done something kind for Aubrey last week, this week Aubrey took Sasha's mom to lunch.",What will happen to Aubrey?,enjoy some time out with Sasha's mom,yell at Sasha's mom at lunch,go without lunch that day,1
2445,Robin raised their level of understanding after a hard week of teaching.,Why did Robin do this?,help them,plan a vacation,make them fail,1
2446,Jan raised their arm above their head to lower her blood pressure.,How would Others feel as a result?,quite surprised,very mad,very angry,1
2447,"Once Aubrey heard the bell ring, he quickly left the classroom for the bathroom.",What does Aubrey need to do before this?,go to the bathroom,plan an exit from class,have an urge,3
2448,"Casey finally converted herself to Christianity on the advice of Kai, after years of not believing.",What will happen to Others?,be proud,be sad,be mad,1
2449,Cara didnt have a car. Austin loaned his to her.,What will Austin want to do next?,get the car back,borrow the car from Cara,be nice,1
2450,Ash ordered 30 catered sandwiches from a nearby sandwich store for a lunch meeting at noon but the meeting was delayed.,What will Ash want to do next?,feed everyone,change the number of sandwiches,pick up the order,3
2451,Sydney made waves in class by questioning if the school book was right.,What will Sydney want to do next?,not listen to what others think,right,rewrite the book,1
2452,Jan was trying to organize a town_wide garage sale so she divided the town into districts.,What will happen to Jan?,be overwhelmed,be fired,accomplish the task,3
2453,Jordan found therapy to help him work through the pain.,What will Jordan want to do next?,attend all therapy sessions,recommend the therapy,deal with the pain himself,1
2454,Carson received gifts from the other members and he smiled at their generous thoughtfulness.,What will Carson want to do next?,act apathetic,show indifference,show his gratitude,3
2455,"Kendall was trying to study and needed absolute quiet, so Skylar complied with Kendall's request.",How would Kendall feel as a result?,would ask Skylar to stay quiet,would be pleased with Skylar,stay away from Skylar,2
2456,Taylor coupled with Remy's interest and they started a business together.,What will Taylor want to do next?,open a store,cheat Remy,take a nap,1
2457,Sasha spent time with their kids. Because Sasha is good around kids and parents trust her.,What will happen to parents?,give away kids,open a day care,be thankful to Sasha,3
2458,jordan liked taylor so taylor used jordan's name.,How would Jordan feel as a result?,calm,that they used Jordan,guilty over using Jordan,1
2459,"Casey crunched the numbers, but could not find a way to pay for the cruise.",What will Casey want to do next?,go to an accountant,save up more and take the trip later,brag about their finances,2
2460,Austin expressed their willingness to cooperate with the police to find the murderer.,How would Austin feel afterward offering cooperation?,like a criminal,aware and invovled,interested in getting justice for the victim,3
2461,Kai brought ice for the party and put it in the kitchen.,How would Kai feel afterwards?,like a good friend,like a selfish person,like a fool,1
2462,Remy closed early because she had a family emergency.,How would Remy feel afterwards?,competent,careless,thoughtless,1
2463,Skylar went to the airport and got a plane ride to a new country.,Why did Skylar do this?,be bored,go somewhere new,be upset,2
2464,Cameron's boss hires Ash because Cameron isn't completing their work load. Ash has taken over Cameron's job responsibilities and Cameron has nothing to do all day.,What will happen to Cameron?,have to follow Ash's lead on the job,have to find a new job or career,do well at the job,2
2465,"When all the towels were handed out, Ash accidentally got Cameron's towel.",How would you describe Ash?,be unhappy about the mix,very neutral,someone who needs a towel,1
2466,Remy didn't brood over the messy breakup and started their new life instead.,Why did Remy do this?,put the past behind them,better,forget about their family,1
2467,Sydney slid Taylor's hands into the mittens so that Taylor would not be cold when they went out.,How would Sydney feel afterwards?,angry at Taylor,caring towards Taylor,indifferent towards Taylor,2
2468,Alex saw Kendall's boss while they were out and said hello to them.,What does Alex need to do before this?,be shopping,Be courteous and friendly,know Kendall's boss,3
2469,Sasha wanted to meet Sydney's family so they took them out to dinner.,What will Sydney want to do next?,find the family,offer to get dinner,go to a restaurant,3
2470,Skylar set a new school record for the long jump in track.,How would Skylar feel afterwards?,awkward,a student at a school with a track team,elated,3
2471,After Jordan's father died Jordan took her to Hawaii for a break from everyday life.,The others would feel how about this?,a fatherless person,outraged,pleased,3
2472,Sasha took a lunch break in the park to eat her sandwiches.,Why did Sasha do this?,eating lunch,she hated nature,she loved the park,3
2473,Kai had a good connection with Sydney as time went on.,What will Sydney want to do next?,get to know Sydney,spend time with Sydney,Remain connected,3
2474,Austin and Taylor had been neighbors for five years. Taylor drove Austin's car to work.,How would Austin feel as a result?,glad to have Austin as a neighbor,helpful,nervous,2
2475,Lee was spending too much money on repairs so he wanted to save as much as possible by shopping around.,What does Lee need to do before this?,find the best price for repairs,buy expensive repair parts for quality,use the next repair shop despite the price,1
2476,Aubrey opened Kai's mouth to say something but kai was malfunctioning and the robot would need adjustments.,What will Aubrey want to do next?,confront the robot Kai,make some alterations to Kai's operating system,ignore Kai,2
2477,Alex led Quinn into the room where the people were waiting to surprise Quinn.,What will Quinn want to do next?,be surprised,sneak Quinn in,eat lunch,1
2478,Bailey wanted Aubrey's parents' blessing to proposed to her.,What will Bailey want to do next?,eat Chinese food,jump off a bridge,buy a ring,3
2479,Cameron locked the safe after Taylor got out what they needed.,Why did Cameron do this?,count the money that was given to Taylor,lock the safe,make Taylor promise to pay the money back,1
2480,Skylar took their dog to a park and he played with other dogs.,How would Skylar feel afterwards?,frustrated,happy,angry,2
2481,Austin put Kendall and teresa to the war so that they could fight for their country.,What does Austin need to do before this?,sign them up,yell at them,receive power,1
2482,Ash paid their maid a lot of money cause she did a great job.,What will happen to Others?,buy some eggs,become a telemarketer,get money,3
2483,Kendall was too shy to ask Aubrey on their own.,How would Kendall feel as a result?,nasty,enraged,relieved,3
2484,Sydney and Kai were best friends. Sydney wanted Kai to stay over at her house.,What will happen to Sydney?,ask her parents,go to Kai's,stay over,1
2485,Aubrey showed Remy's mom the questionable texts she'd received that afternoon.,How would you describe Aubrey?,mad,careless about others,someone who worries,3
2486,Riley likes having a great day and is hoping for one today.,How would Riley feel about today?,Today will be an awful day,Like today will be awful,Like today will turn out great,3
2487,Sasha extended Skylar's probation at the expense of everyone else because of his poor behavior at the office.,What will Sasha want to do next?,ensure Skylar abides by the rules,meet with human resources to file a grievance in Skylar's account,ensure she herself abides by the rules,1
2488,"Ash was groggy and shaky from having the flu, but recovered their senses in time for the beach vacation.",Why did Ash do this?,alive after being deceased,go to the beach badly,needed to get better,3
2489,Carson loved to swim and was training for a national competition.,How would you describe Carson?,competitive,lazy,fat,1
2490,"Jesse was Robin's banker and because Robin was busy, Jesse kept Robin's balance in order.",How would you describe Jesse?,Careless,looked-after,Needed,3
2491,Robin prevented them from passing down the hallway to get to class.,What will Others want to do next?,know why Robin did this,be a mean person,apologize,1
2492,Alex changed Addison's life for the better by offering them a good job.,What will Addison want to do next?,get on addison's good side,make addison like them,do their best,3
2493,Skylar and Alex were about to break up. Skylar met Alex for the last time.,Why did Skylar do this?,Call her mother,plan their marriage,talk about emotions,3
2494,Jesse sat near Cameron in class and they had to try not to talk.,What will happen to Cameron?,decide to talk in class with their friend,have fun in class with their friend,think that they are in trouble,1
2495,Austin wanted to finish the chores and reached the goal with out much effort.,How would you describe Austin?,As someone who got things done,As someone who thinks about chores,tired,1
2496,Alex never would have found out if he hadn't found the love letter his wife sent to someone else.,How would Alex feel afterwards?,loved,clever,betrayed,3
2497,Bailey went to the store and used a coupon so that they could save money.,What does Bailey need to do before this?,get in the car,pay for the food,buy a backpack,1
2498,kendall opened remy's gift and it turned out to be exactly what they were hoping for.,What will kendall want to do next?,hate the gift,enjoy the gift,ignore remy,2
2499,Jan said something snide to Skylar that they didn't appreciate one bit.,How would Skylar feel afterwards?,complimented,pleased,offended,3
2500,"Quinn was the pastor at their church, so Quinn gave glory to god.",Why did Quinn do this?,be blasphemous,give a sermon,praise the lord,3
2501,"After finding out they had a winning lottery ticket, Addison screamed with delight.",What does Addison need to do before this?,are joyful,purchase a lottery ticket,are delighted,2
2502,Carson brought Casey inside to get him out of the rain.,How would Carson feel afterwards?,helpful,angry,insecure,1
2503,Alex got out of the cage that a person had put them in forcefully.,How would Alex feel afterwards?,regretful,free,skilled,2
2504,Carson called home to tell her parents the news.,How would you describe Carson?,excited for Carson,excited,Shy,2
2505,Aubrey put the cake in another way. It was the wrong way.,What will Aubrey want to do next?,start over,do it the wrong way,there was other stuff in the oven,1
2506,Lee brought their things and the catch back home.,Why did Lee do this?,be lazy,be a slacker,provide for the family,3
2507,Casey and Taylor were wrestling. Casey rolled onto Taylor's back.,What will happen to Casey?,get hurt,in charge,sad,2
2508,Alex had offered to host the village meeting at their fathers house. People were waiting for him outside when he arrived.,What will Others want to do next?,invite people,The others will walk away from the house,The others will walk in to the house after Alex,3
2509,Lee tried to hold back from saying what she thought.,How would Lee feel afterwards?,good she showed restraint,scheming,shrewd,1
2510,Robin asked Sasha for her help with the project she was doing.,How would Sasha feel as a result?,good,answer Robin,thank Sasha,1
2511,Aubrey's car kept breaking down on her. Aubrey decided to buy a new car to keep her safe.,What does Aubrey need to do before this?,needed to get rid of the old car,needed to get rid of the new car,safe,1
2512,Remy and Aubrey were competing against each other in a high school wrestling match.,What does Remy need to do before this?,start wrestling,get in the ring,needed to get both hands on Aubrey's head,1
2513,Kai needed to move back home to save up money so they could get a new place.,Why does Kai need to do this?,reduce their cost of living,miss their friends,get a bank account,1
