,context,question,answerA,answerB,answerC,label
0,Addison made a mistake yesterday and today ordered what they usually ordered for lunch.,How would Addison feel afterwards?,Like they know what they are getting for lunch,careless and unprepared,Like they made the mistake again,1
1,Kendall took their allowance and lost it while playing at the park.,What will Kendall want to do next?,punish Kendall,go to the store and spend the money on candy,go back to the park and look for the money,3
2,Riley walked to the mall and bought some clothing that was there.,Why did Riley do this?,shop,be rude,put on his shoes,1
3,Ash layered another blanket to stay warm on the cold night.,What will Ash want to do next?,needed to have ordered the blanket,needed to have purchased the blanket,Get some heavier socks,3
4,"After the landlords decided to raise rent $300, Quinn decided to move.",What does Quinn need to do in order to move?,pay her landlords $300,rent a moving van,find a new apartment,3
5,Riley stayed friends with everyone after they moved away.,What does Riley need to do before this?,of been friends,think they should move,talk about their friends,1
6,Kai walked home with Ash after they fell off of their bike.,What does Kai need to do before this?,clean up their wounds,walk with their bike,go to Kai's home,1
7,"For the first time ever, Casey made a social media profile online.",What will Others want to do next?,connect with Casey online,ignore Casey's new profile,add pictures,1
8,Tracy ripped open the bag of chips and dumped them on the floor to get back at her friend.,Why did Tracy do this?,get revenge,walk away in anger,yell at her friend,1
9,Quinn dropped the anchor off the boat but it broke off and they drifted out to sea and were lost for weeks.,How would Others feel as a result?,were scared,were happy,careless,1
10,Bailey made pie for their family for Thanksgiving.,Why did Bailey do this?,eat something else,hide their cooking skills,show off their cooking skills,3
11,"Having never been to an hill top, Cameron finally went with a friend to see what it was like.",How would you describe Cameron?,very fearful of height,an adventurer,very timid,2
12,Quinn heard talk about the new girl in the building. Quinn made a lot of assumptions when they saw them.,How would you describe Quinn as a person?,would be embarrassed,a helpful person,a uninformed person,3
13,Riley could afford anything in the store but chose to limit their spending because of the recent economic downturn.,Why did Riley do this?,find special sales,use coupons,have good foresight,3
14,Jan accomplished their purpose and managed to get the promotion at work.,What does Jan need to do before this?,get noticed by management,sleep a lot,get reprimanded by management,1
15,Casey wanted to try something new with her dad so they went horseback riding.,What will Casey want to do next?,try something else,take the horse to eat,hurt the horse,1
16,Tracy got in her car to go across the country and visit Canada.,How would you describe Tracy?,would be happy she experienced the trip,free spirit,would be glad she went on the trip,2
17,Jan finally found it in the washroom sink.,What does Jan need to do before this?,Stop caring about it,Look for it,Disregard it entirely,2
18,"Austin was not a very well trained dog, so when Skylar asked for a kiss, Austin bit Skylar's lower lip pretty hard.",What will Austin want to do next?,play with toys with Skylar,hit the dog,punish the dog,3
19,Skylar afforded Tracy an opportunity to go to the mall that day.,Why did Skylar do this?,take Tracy shopping,loved,go to the mall with Tracy,3
20,Aubrey carried out their duties as team manager and the project was finished ahead of schedule.,How would Aubrey feel afterwards?,successful,incompetent,inept,1
21,Alex stood shoulder to shoulder with them even though he was still young and naive.,How would Alex feel afterwards?,accomplished,naive,not scared,3
22,according to the article  Carson immediately stopped.,What will Carson want to do next?,wait,help watch out,keep calm,3
23,Cameron gave Alex a peck on the hand and a suggestive wink to them.,Why did Cameron do this?,be a flirt,be disgusting,ask Alex out on a date,1
24,Lee is a botanist.  They identified every plant when high school students asked them questions.,Why did Lee do this?,ask the students their knowledge about plants,see more plants,show their knowledge about plants,3
25,"Kai needed a place to stay for the night, so they stayed at Addison's house.",What will Addison want to do next?,help out Kai,she wasn't home,let Kai stay there often,1
26,Lee brought the car to work and got a ton of compliments about the new paint job.,How would Lee feel afterwards?,hard working,indifferent,proud,3
27,"Jordan was an exceptional writer and when approached by Riley, Jordan agreed and wrote Riley's autobiography for a tidy fee.",What will Riley want to do next?,not read the autobiography,thank Jordan,publish another book,2
28,Remy invited friends over to play some games for a few hours.,How would you describe Remy?,feeling in awe,excited to go play games with their friends,happy to be invited over to Remy's house,2
29,Austin rode a bike on a beautiful mountain range.,How would you describe Austin?,refreshed,lazy,exercise-minded,3
30,Skylar divided the voters into groups after taking all of their names.,How would Skylar feel as a result?,political,commanding,divided,2
31,Aubrey came to Tracy's knowledge about the business deal that was happening next week.,How would Tracy feel as a result?,rich now,bored now,lazy now,1
32,"At the qualifying race to move on to the statewide finals, Kendall was the last one to finish the race.",What will happen to Kendall?,get a medal,be kicked off the team,be upset about their performance,3
33,Jan planted a garden in her backyard but gave up on it quickly after something went wrong.,How would you describe Jan?,lazy,patient,diligent,1
34,Jan got really good at reading and helped others learn to do it as well.,How would Jan feel afterwards?,very helpful,mean spirited,bored and sad,1
35,Lee gave Riley a glimpse into what life with Lee could be like.,How would Riley feel as a result?,like they understand Lee better,curious,they do not see anything,1
36,Business has been booming at Jordan's job. Because of this Jordan has to work more hours than normal.,How would Jordan feel afterwards?,Full of energy when he gets home from work,Like he needs a day off soon,hard working,2
37,Casey followed the dog far before finally catching him and bringing him home.,How would you describe Casey?,home,committed,tired from chasing the dog,2
38,Jesse was living their dream sailing the oceans on her boat.,What does Jesse need to do before this?,blog about her life,write travel articles,decide to sail on the ocean,3
39,Riley ate the cake and offered some to the guests as well.,What will Riley want to do next?,give the cake to charity,keep the cake private,make sure everyone gets a slice,3
40,Jesse saw a movie with their friends but they talked loudly the whole way through and refused to help pay for the group's snacks.,How would friends feel as a result?,a good friend,friends with rude people,angry at Jesse,3
41,Remy got a new phone after her old one had been cracked for months.,How would Remy feel after?,depressed about losing her old phone,excited about her new phone,sad to see her phone go,2
42,Kendall was hungry so they ate some food.,What does Kendall need to do before this?,get some food,Go shopping for food,Eat more food,1
43,"Quinn walked the floor, looking over the shoulders of the workers to make sure they were performing to standards.",How would Quinn feel afterwards?,superior to the other workers,superior to the company president,proud to serve the country,1
44,Ash stayed away from the kitchen while his mom was cooking.,What will Ash want to do next?,eat the meal that his mom cooked,did not like to be in the kitchen when his mom cooked,did not like the smell of his mom's cooking,1
45,Skylar caught Quinn peeking at the homework and reported it to the teacher as cheating.,How would Quinn feel as a result?,be happy,like they were snitched on,proud,2
46,Tracy went to Sasha's house to study but Sasha had other plans on how to spend the day.,What will Sasha want to do next?,find a different place to study,distract Tracy from studying,study the next day,2
47,Kai turned Skylar's car around and almost ran it into a tree.,What will Skylar want to do next?,let Kai drive more,be more alert,go back and get his phone,2
48,"Sasha is a baker and makes cakes for her customers. As Sasha was reading the ingredients to bake 10 cakes, she realized that she needed milk from the store.",What does Sasha need to do before this?,buy from the store to ensure that she has enough for the cakes,postpone cake baking,change clothes,2
49,Tracy bent Jordan's head backwards to help stop the nosebleed.,How would you describe Tracy?,kind,helpful,violent,2
50,Bailey answered all the questions correctly because she had studied hard on the test.,How would you describe Bailey?,a smart student,someone with high work ethic,proud of their dedication,2
51,Cameron put Tracy's arm around Tracy to help put her to sleep one night.,How would Tracy feel as a result?,upset,comforted,angry,2
52,Aubrey didn't know which fruit to pick so she started picking oranges at random.,What does Aubrey need to do before this?,find rotten fruit,get on a plane to get to the fruit,find a fruit basket,3
53,Casey bought cookies from a friend to share with the office.,What will Casey want to do next?,be more popular,not share the cookies,bring the cookies to the office,3
54,Remy looked at the cat right in the eye the other day.,What will happen to Others?,an animal person,likes to be around animals,Others will like the cat,3
55,taylor wanted to please her daughter so she got her presents.,How would you describe Taylor?,as kind,grateful to Taylor,excited for presents,1
56,Alex lived in Cameron's house and was incredibly messy and loud at all times of the day and night.,What will happen to Cameron?,be yelled at,tell Alex to leave their house,be kicked out,2
57,"It was time to take down the tent, so Carson pulled up the stakes.",What will Carson want to do next?,cook some steaks,put away the camping gear,buy a tent,2
58,Cameron lost Ash's job after they were doing poor work quality.,What will Ash want to do next?,be angry at Cameron,work elsewhere,cover Ash's shifts,1
59,Kendall kissed Quinn's neck after they had a nice dinner with wine.,What will Kendall want to do next?,whisper many threats into Quinn's ear,move the kissing into the bedroom,move the kissing into the airport,2
60,Austin touched Riley's arm and they went to the cafe for drinks.,What will Austin want to do next?,indifferent,loved,bored,1
61,"Cameron loves visiting children, he bought them juice.",How would you describe Cameron?,a bed person,cherished and loved,a child lover,3
62,Skylar went to the mall and bought a brand new pair of shoes.,How would you describe Skylar?,like wearing her new shoes,a mall lover,boring,2
63,"Taylor needed new shoes, so he can train for the big race this weekend.",How would Taylor feel afterwards?,lazy,conflicted,proud,3
64,Kai hired his best friend immediately after the friend lost their job.,Why did Kai do this?,did this because his friend had too many jobs,did this because his friend was over-qualified,did this because he has compassion,3
65,"Riley had gotten separated from the group and become lost in the forest, but Sydney led Riley back to safety.",What does Sydney need to do before this?,lead the team,care for Riley,find Riley,3
66,Addison's birthday was tomorrow so Kai got Addison's friends together for the surprise party that he was throwing.,How would Addison feel after?,excited about the party,disappointed in the decor,disappointed in the cake,1
67,Lee felt the force keenly on his back as he was picking up the stone.,What does Lee need to do before this?,bend knees while lifting,lift the stone slowly,needed to grab the stone,3
68,Riley got popular and everyone wanted to hang out with him.,What will happen to Riley?,they will be jealous,be supported,they will despise him,2
69,"Robin was moving into a new house and asked Quinn to help, but there was too much stuff, so Quinn brought friends.",How would Robin feel as a result?,very tired,very grateful,very exhausted,2
70,Robin knew Sydney well and could tell what they were thinking.,How would you describe Robin?,unobservant,grateful for Robin,intuitive,3
71,Austin waited their turn in line to have a go on the roller coaster ride.,What will Austin want to after waiting in line?,enjoy their turn on the coaster,use the restroom,walk to the back of the line,1
72,Jesse has a date and wants to look and feel very clean.,What does Jesse need to do before this?,get in the shower,go to a salon,be liked,1
73,Jordan gave Taylor the right book to read on her vacation.,How would Jordan feel afterwards?,depressed and lonely,taken care of,sad,2
74,Sasha had taken care of a friend while they were sick and now Sasha has a fever.,How would you describe Sasha?,concerned about being ill,like their friend got them sick,wanting to go to the mall,2
75,Ash tried Addison's hardest problem and was able to solve the problem with ease.,How would Ash feel afterwards?,proud,skilled at figuring out difficult problems,indifferent,2
76,Bailey ran out of money so she moved back in with her parents.,Why did Bailey do this?,help her find a job next,was broke,was rich,2
77,austin had a craving for meat so he decided to make chicken for lunch.,What does Austin need to do before this?,be hungry,make plans to go swimming,beg austin to hurry up,1
78,Austin has an addiction to playing video games and is trying to reduce his playing time.,How would Austin feel afterwards?,Upset because he didn't like playing,Relieved because he needed to play the game,working to better his life,3
79,Quinn bought enough time when trying to estimate how long the call would last.,Why did Quinn do this?,So everything could be said,Out of inexperience with the process,get the feeling of being rushed,1
80,Tracy asked Lee to meet them at the park that day.,What will Tracy want to do next?,talk to Lee,hang out with Lee,go to the park,2
81,Sydney placed Remy's phone where he could reach it when his leg was broken.,Why did Sydney do this?,did this to be selfish,did this to be helpful,grab his phone,2
82,Casey saw what was wrong with Sasha and called an ambulance.,How would you describe Casey?,anxious and upset,a bad friend,unworried about Sasha,1
83,Cameron made a decision to pour the ashes onto the water.,Cameron will want to do what afterwards?,see what the deceased wanted,explain why they poured the ashes in water,have a funeral,2
84,Casey saw an ad in the paper wanting a nanny for twin babies.,What does Casey need to do before this?,despise children,search for a job,be afraid of babies,2
85,Casey was at the park and saw Carson's aunt.,What does Casey need to do before this?,say hello,know Carson's aunt,of learned about the park,2
86,Skylar moved to a new town and wanted to make new friends.,How would Skylar feel afterwards?,sociable with new friends,nervous,excited,2
87,We couldn't have gotten the TV to work again without Taylor's help.,How would you describe Taylor?,watches TV all day,can fix things easily,Others will be happy to be able to watch TV,2
88,Jordan ate healthy and watched her diet.,Why did Jordan do this?,likes to be fit,join a weight loss program,plan to lose weight,1
89,"The neighbors were loudly fighting again and Kai couldn't sleep. So, Kai tried to watch a movie instead.",What will Kai want to do next?,drown out the noise,enjoy the silence,go back to sleep,1
90,Bailey learnt to swim then they worked really hard to learn all the different strokes in swimming and become expert at them.,What will Bailey want to do next?,join a hockey team,join a water polo team,join a dancing group,2
91,"Audrey's son, Bailey, wants a Christmas tree.  Audrey got Bailey's tree.",What will Bailey want to do next?,put the tree at a corner,thank Audrey,decorate it,3
92,Tracy made Bailey a Ruben sandwich and chips for lunch.,What will happen to Tracy after lunch?,she will eat the sandwich,helpful,she will thank Tracy,1
93,Tracy used their skateboard as a means of transportation because they don't have a car.,What will Tracy want to do next?,be alone,Buy a skateboard,meet up with friends,3
94,Skylar was killed by a stray bullet that came out of a gun.,What will Others want to do next?,hold a funeral,be laid to rest,throw a party,1
95,Tracy lived with her best friend Riley's mother while her own mother was in the hospital recovering.,What will Riley want to do next?,Visit her father at the hospital,Be courteous to the doctor treating her grandmother,Visit her mother in the hospital,3
96,Cameron finally hired a replacement but still needed to train her.,What will Cameron want to do next?,eat dinner next,see a movie next,train her next,3
97,"Riley told me what Jan wanted.  Therefore, I bought groceries for both of them.",What will Jan want to do next?,Thank me,eat out,pay me for the grocery,1
98,Jordan headed toward the door. She wasn't happy about the way the meeting had gone.,How would Jordan feel afterwards?,ready to go home,frustrated with the meeting,angry,2
99,Jan effects Quinn's escape by sabotaging it and calling the police.,What will happen to Quinn?,go to jail,proud,smart,1
100,Jan played a part in the etiology so that the research would progress well.,What will Jan want to do next?,avoid the research,help the researchers,ignore the researchers,2
101,Kai got back to sleep and woke up the next day to begin training again.,What will Kai want to do next?,strong,be the best warrior,lazy,2
102,Remy grabbed Bailey's wallet and went to the store to buy some food.,How would you describe Remy?,the need to apologize about it,guilty about it,feeling worried,2
103,Tracy had to take the SATs on Saturday and spent the whole week studying.,Why did Tracy do this?,wanted to get into a good college,get books,study,1
104,Robin cleared Kai's mind in a therapy session that they had with Kai.,Why did Robin do this?,make Kai forget things,talk to Kai,assist Kai psychologically,3
105,Kai gave one of the books to a child in need that couldn't afford it.,Why did Kai do this?,hug the child,good,book-wormy,2
106,Alex asked Ash to help them when they were studying for their test.,How would you describe Alex?,needing help,struggling to study,Thankful for Ash's help,2
107,"Lee was playing with all the kids, she built a snowman for them to have fun.",How would you describe Lee?,someone who loves kids,unfriendly,someone who likes to be alone,1
108,"Lee reached for his phone and looked at it, deciding whether to call.",How would Lee feel afterwards?,a hardworking person,excited,nervous,3
109,Addison was having her birthday party in the afternoon and nobody came.,How would Addison feel afterwards?,someone with poor party planning skills,rejected,happy,2
110,Robin talked to their brother about gifting their parents a cruise to the Bahamas.,What will happen to their parents?,angry at spending money,shop for cruise clothing,be upset at the nice gift,2
111,Cameron locked the door behind Taylor so no one could get in.,How would you describe Cameron?,scared,afraid,Cautious,3
112,"Addison put Kendall's work into action, which made Kendall very successful in the long run.",What will happen to Kendall?,be rewarded,be looked up to,make a lot of mistakes,1
113,Bailey loved to help the environment. Bailey hardly drove their car to work.,How would you describe Bailey?,someone who usually drives their car to work,someone who cares about pollution,accomplished for getting to work without a car,2
114,Taylor stayed after school to study for a big test that was coming up tomorrow.,Why did Taylor do this?,go home and get some rest,get a good grade,cheat on the test,2
115,"Jan sets up a home made items only, bake sale for her volleyball team. Everyone meets at Jan's house to bake items for the bake sale.",What does Jan need to do before this?,purchase supplies to bake the goods,go to the bake sale and sell some goods!,buy baked goods to sell at the bake sale,1
116,Quinn was nervous about going sky diving. Quinn finally agreed to do it.,What will Quinn want to do next?,good about over coming a fear,go to the airport,cancel the adventure that's planned,2
117,Alex read Robin books and got a lot of inspiration from the novels.,What will happen to Robin?,bored,conflicted,loved,3
118,Ash wanted to catch up with her friend so Ash and her friend ate lunch together.,What does Ash need to do before this?,be sociable,forget to bring her money,tell her friend that she wanted to eat lunch together,3
119,"On his first day as a police officer, Skylar gave the man a speeding ticket.",What does Skylar need to do before this?,Call and ask for backup,Complete Police Academy,Ask the driver if he was okay,2
120,Tracy got to know everyone and ended up fitting right in.,What does Tracy need to do before this?,be rude to everyone,hang out with them,be friendly to everyone,3
121,Remy left the paint in their hands and they got it all over the wall.,What will Remy want to do next?,blame Remy,tell Remy to stop,reprimand the others,3
122,Aubrey sang the song perfectly after practicing for many months.,What does Aubrey need to do before this?,wanted to get good,wanted to perform the audition,train her voice,3
123,Kai was part of a boxing club so when school finished Kai walked there from school.,Why did Kai do this?,get boxing clothes on,spar,train,3
124,Carson persuaded their friend to accept. They knew it was a wise idea.,How would you describe Carson?,a good friend,bad with people,a bad friend,1
125,quinn was in the military so she bought food at low prices.,Why did Quinn do this?,donate food at low prices to others,save money,needed to sign up for the military,2
126,Robin was at ease.,How would Robin feel as a result?,less stress and uneasy,ready to work hard,friends with Robin,2
127,jesse thanked the university for a grant and others were angry that they didn't get a grant.,What will happen to Others?,be jealous,try to help the other students,be happy,1
128,Quinn bought pills without prescription. He had a phony prescription made up.,How would Quinn feel afterwards?,happy,liar,guilty,3
129,Remy made a huge difference to the charity by donating a large sum of money.,How would the volunteers feel as a result?,thankful to Remy,superior to Remy,inferior to Remy,1
130,Casey popped Jordan's cherry after prom that they attended together.,What will Casey want to do next?,break up with jordan,cuddle with jordan,hit jordan,2
131,Skylar quit her old job when she got a much better offer.,Why did Skylar do this?,tell her boss she was quitting,did this for a better job,submit a formal resignation letter,2
132,Robin got a hotel room to sleep at on her big business trip.,How would you describe Robin?,feeling bored,well rested for her out of town work,feeling smart,2
133,Carson got rid of the mess from the party in his girlfriend's apartment.,Why did Carson do this?,make sure his girlfriend wasn't stressed about it,take a nap,hug his girlfriend,1
134,"Bailey is a kid, and just took swimming lessons.",What will Bailey want to do next?,take more swimming lessons to learn how to swim,stop swimming altogether,can swim in the deep end,1
135,Lee defended Austin's rights to free speech even if it's unpopular.,How would Austin feel as a result?,respected,committed to the first amendment,insulted,1
136,Jordan watched movies all night after he have broken with his girlfriend.,Why did Jordan do this?,get a snack,enjoy the movies,forget the pain,3
137,Quinn ate chicken at home with her family for Sunday dinner.,What does Quinn need to do before this?,go to the store,order a pizza,make some soup,1
138,Sydney did not like the glasses Aubrey was wearing and made fun of her.,What will happen to Aubrey?,become better off,develop a disorder,get in trouble,2
139,"Jesse wanted to treat his friends, so he took money to a bar.",How would Jesse's friends feel as a result?,like Jesse was a great friend,like taking advantage of Jesse,buying the most expensive drinks,1
140,Austin heard Sydney's voice and then went to look for her.,How would Austin feel afterwards?,Angry,a caring friend,Excited,3
141,Addison made Austin act in the play for the next few weeks.,Why did Addison do this?,rehearse with Austin,teach Austin lines,smart,1
142,Taylor put itching powder on Bailey's toothbrush so that his teeth would itch.,Why did Taylor do this?,prank him,clean his teeth,his teeth would itch,1
143,"Riley decided to take a stroll, but she could only do this after getting some food and feeding her fish.",What does Riley need to do before taking a stroll?,feed the fish,get some food,eat some fish,1
144,Lee caught the ball with his hands when he turned and saw it heading for him.,Why did Lee do this?,not get hit,drop the ball,get hit by the ball,1
145,Ash came home and had a horrible headache. Medication hadn't helped so they decided to try and take a nap.,Why did Ash do this?,Try something else since the medication hadn't helped,go to bed,Take some medication that might help,1
146,Remy taught the pet to think about things before it acted on them.,How would Remy feel afterwards?,like they are accomplished,upset at the animal,like they know nothing,1
147,It was Robin's first night as a nurse and they detected some distress in the patients.,What will the doctor want to do next?,leave Robin alone with them,give Robin more duties,get an experienced nurse,3
148,Jordan spilled the water all over after they poured the glass.,What does Jordan need to do before this?,apologize,mop up the water,of gotten the glass,2
