,context,question,answerA,answerB,answerC,label
3689,Jesse lost Jordan's car keys while they were out.,What will Jordan want to do next?,ignore the keys,borrow Jordan's car,get new keys,3
3690,Sydney ate lunch with Ash and then they were going to go to the gym.,What will Sydney want to do next?,go to the gym,exercise after a meal,enjoy a meal knowing he would burn calories,1
3691,Remy bought a knife and took it with them to a dangerous part of the town.,What does Remy need to do before this?,protect his family,need a knife,be kind,2
3692,"After tasting them with the new sauce, Ash liked the vegetables better.",How would you describe Ash?,willing to try new things,indifferent towards food,like using the new sauce on every future vegetable dish,1
3693,Bailey stood in Remy's way when Remy tried to get to the outside.,What does Bailey need to do before this?,see Remy trying to escape,ignore Remy,tell Remy to stay inside,1
3694,Lee gave Carson a patient report before he headed home for the night.,What will happen to Lee?,go home immediately,treat the patient,go get some coffee,2
3695,"Because Jan was jealous of the esteem with which coworkers held Casey, she told everybody in the office a horrible lie about Casey.",What will happen to Jan?,will thank her for sharing the news,wonder why Jan said that,will be executed by the program manager,2
3696,Jesse married their high school sweetheart last summer. Jesse lived happily ever after.,What does Jesse need to do before this?,have a first date,have children and grandchildren,become divorced from them,1
3697,Alex's parents were out of town for the weekend. Alex decided to have a party at her house while they were gone.,How would Others feel as a result?,excited,disappointed,happy,1
3698,ash was a tattle tale so she got cameron's mom.,Why did Ash do this?,ask ash why they want to tell on them,be a good person,tell on everyone,3
3699,Aubrey got checked out after she hadn't been feeling well all week.,How would you describe Aubrey?,careful,irresponsible,reckless,1
3700,"After borrowing money from lone sharks and losing it, Lee really needed money.",Why did Lee do this?,was a fan of sharks,was in trouble,borrow more money,2
3701,Carson has been worried about performing well in sport.,How would you describe Carson?,anxious and concerned,believable,stage fright,1
3702,"Ash knew that Jan was low on funds, so she lent her the money to pay for groceries.",What will Jan want to do next?,wanted to do a good deed today,Insult Ash,Go buy food,3
3703,Bailey pulled Tracy's pants off to help her after she saw a bug.,What will happen to Tracy next?,give Tracy their pants back,be scared,laugh from fear,2
3704,Sydney went to the county fair for the first time and rode the Ferris wheel.,What did Sydney do?,rode the Ferris wheel,elated,excited,1
3705,Alex realized that his sink was leaking. Alex called his landlord.,How would Alex feel afterwards?,relieved,a man,a renter,1
3706,Quinn was the goalie on the soccer team and tried to block a shot.,What would others sitting in the stands do?,would tell Quinn to let the ball go,would jump up and scream,a great athlete,2
3707,Lee hit a wall in trying to write their thesis and did not finish it in time.,How would Lee feel afterwards?,disappointed in themselves,happy to make some progress at least,pleased with themselves,1
3708,Jordan contributed to Robin's understanding of physics when he helped her with her homework.,What does Jordan need to do before this?,bring his physics notes to Robin's house,tell Robin he couldn't make it,be a good friend,1
3709,Robin took their date to the movies last night.,What will Robin want to do next?,watch a movie,stand up her date,take Robin's hand,1
3710,Remy converted the suns rays to energy. They are talented at science.,What does Remy need to do before this?,use solar energy,learn math,study hard,3
3711,"Cameron ran some tests on his patient, Kendall because she was very ill.",What will Kendall want to do next?,get medicine,get to the bottom of the illness,find out what was wrong,3
3712,Ash got a hold of Casey on the phone and asked if they could play.,What will happen to Casey?,ask about Ash,go see Casey,go over to Ash's and play,3
3713,Tracy wanted full custody of the children. Jan threatened to kidnap them and this forced Jan's hand.,Why did Tracy do this?,manipulate the Jan's actions,become friends with Jan,try and make Jan happy,1
3714,Jordan turned the person away after they asked to go on a date.,How would the person who got rejected feel?,happy and joyous,regretful and mean,sad,3
3715,Skylar was stealing things from the office a lot. Skylar finally got caught and fired.,What will Skylar want to do next?,apologize,believe they could do whatever they want,stay at home,1
3716,Cameron still didn't know how Alex felt about her but Cameron kissed Alex on the lips.,How would Cameron feel afterwards?,angry at Alex,anxious and unsure,disgusted by Alex,2
3717,Jesse called the nurse into the room because he got afraid for his life.,How would Jesse feel as a result?,like he has no anxiety,alone,comforted,3
3718,Taylor stirred men's desire into giving her all of their possessions.,Why did Taylor do this?,Others will regret being tempted by Taylor,was manipulative,Others will be jealous of Taylor,2
3719,Carson knew the barber well and introduced the others to him.,What will Others want to do next?,talk to the barber,The others will want their hair cut next,jog next,2
3720,Remy put Jan's toy away because they were done playing.,Why did Remy do this?,clean up,do nothing,be bored,1
3721,Casey filled Sydney's heart with Joy when they told them they wanted to date.,What does Casey need to do before this?,become romantically involved with Sydney,get to know Sydney better,want to date Sydney,2
3722,Robin had watched their partner Alex perform in a play and had loved it.,What will happen to Robin?,he will thank robin,celebrate with their partner afterwards,he will appreciate robin,2
3723,"After Bailey saw the sad tv commercial from the international charity about the orphans affected by the disaster, Bailey got their wallet and picked up the phone.",What will Bailey want to do next?,make a monetary donation,adopt an orphan,call up a friend,1
3724,Kendall was tossed the ball but couldn't make the shot. Kendall passed the ball to her teammate.,What will Kendall want to do next?,make sure the team wins,give her  team mate a chance to win,get the ball back,2
3725,Tracy gave Kendall a big hug because she was going away for college.,How would you describe Tracy's feelings?,very upset,very sad,going to miss Kendall,3
3726,Aubrey added water to Bailey's tree and got the tree to grow.,How will Aubrey feel after?,proud of herself,angry that the tree grew too much,sad that the tree grew,1
3727,Tracy adopted a child because she thought there were a lot of orphans who could use a home.,Why did Tracy do this?,check on children,have a home,be empathetic,3
3728,Skylar put the baby in Ash's car when they were getting ready to go.,What does Skylar need to do before this?,drive the car,have to go somewhere in Ash's car,double check the baby,2
3729,Skylar felt confident and wanted to try the high jump at the pool.,What will Skylar want to do next?,jump off the high dive,go to a cook out,error on the side of caution,1
3730,"The group of children were out of control, and the parents were trying to calm them down, so when she got her son away from the situation, Sasha gave their son a talking to.",What will Others want to do next?,wanted her son to learn from his mistakes,wanted her son to learn a lesson,talk to their own children,3
3731,Robin was a sunday school teacher at her Church.,Why did Robin do this?,be a good influence,take a break,be quiet,1
3732,Aubrey showed Bailey's appreciation by giving him money to pay off school.,What will happen to Bailey?,Be thanked by Bailey,be a slave to Aubrey,be a student,3
3733,Taylor asked the librarian for help finding the book.,What does Taylor need to do before this?,look for the book,hide the book,find the book themselves,1
3734,Quinn had money to go shopping and he spent the money quickly.,How would Quinn feel afterwards?,as wealthy,like it was worth the cost,as impulsive,3
3735,Sydney sounded Casey's alarm and tried to wake them up for the third time.,How would you describe Sydney?,a dedicated individual,angry at Casey,tired of sleeping in,1
3736,"While trying to convince their friends to join the at church, Ash shared her beliefs about religion.",What will happen to Ash?,uncomfortable,self righteous,discuss religion with her friends,3
3737,Bailey joined forces with the team to solidify her position.,Why did Bailey do this?,sabotage herself,practice,be stronger,3
3738,Kai let the dog in the house because it had started raining.,What does Kai need to do before this?,notice it was raining,give the dog a treat,dry off the dog,1
3739,Jan finished Skylar's work so that Skylar wouldn't spread Jan's dirty secret.,Why did Jan do this?,maintain their privacy,get everything out in the open,take advantage of Jan,1
3740,Taylor pressed Skylar's hands on the table to keep her from striking out.,How would Taylor feel afterwards?,didn't want Skylar to be mad,like a criminal,he saved her from trouble,3
3741,Carson got a good night's rest before the test and managed to get a good score.,How would Cameron feel afterwards?,sad about their performance,happy about their grade,mad at their grade,2
3742,Remy was attending a very important lecture on Finance which was on her exam. Remy took notes to make sure she remembered.,What will Remy want to do next?,not look at the notes again,save the notes,pass the exam,2
3743,Tracy misplaced her car keys when it was time for work they were no where to be found. Tracy looked every where trying to find the keys.,Why did Tracy do this?,ride the bus,needed the keys to drive to work,call her friends and ask for a ride to work,2
3744,robin held the ball in ash's arms so that ash would know how the game is played.,How would Ash feel as a result?,hurt by robin,good about learning the game,bad about learning the game,2
3745,addison needed something done secretly so he exposed the person to a number.,What will Others want to do next?,be untraceable,listen to addison,ignore addison,2
3746,Remy kept to themselves a lot and didn't have friends. Remy played a lot of chess online.,What will Remy want to do next?,keep playing chess,win the chess,find a new game,1
3747,"Cameron called in sick at the hospital, so Jordan made Cameron's rounds.",What does Jordan need to do before this?,do their own rounds,go to bed and rest,call in sick,1
3748,Kendall is shopping for a used car and is evaluating a potential choice.,How would Kendall feel afterwards?,foolish,pleased,lazy,2
3749,Skylar destroyed the toy city that Kai and her friends built that day at school with a toy car.,How would you describe Skylar?,feeling left out and got jealous,a calm and even-tempered child,sorry afterwards,1
3750,"Casey kept getting the incantation in the book wrong, so they urged Bailey to accept defeat. Bailey ultimately got the incantation correct and temporarily trapped the spirit in the mirror.",What will Bailey want to do next?,read the book,Destroy the mirror so the spirit can be free,Seal the mirror properly so the spirit can't escape,3
3751,Sasha played catch with Addison's dad and took a liking to baseball.,What will Addison want to do next?,join a baseball team,get a mitt,quit baseball,2
3752,Jan started climbing the tree. She always took risks and sometimes paid for them.,How would you describe Jan?,reclusive,risk taking,daring,2
3753,The results of her research were in and showed that Addison improved survival rates in patients. The new drug was a success.,How would Others feel as a result?,reluctant to try the new drug on their own patients,unavailable to anyone,available to them,3
3754,Remy wanted to go hiking yesterday but their shoes were uncomfortable and they needed new ones.,What does Remy need to do before this?,save his money for a new pair of running sneakers,buy new shoes,save his money for a new pair of hiking boots,3
3755,"Aubrey told the waitress that they'd like another steak, because theirs came out cold.",What will Aubrey want to do next?,pay extra for their meal,wait for a new fish to come,wait for a new steak to come,3
3756,"The car has been making strange noises all week, so Addison checked Skylar's car.",What will happen to Skylar?,be thaked,have to buy a new car,throw the car away,2
3757,casey was good at saving money so she kept spending to a minimum.,How would Others feel as a result?,as calm,A wise person,as impressed,3
3758,Alex started a fund raiser to help under privileged children. Alex ended up raising more money than their goal.,How would Alex feel afterwards?,Unhappy and surprised,Accomplished and happy,Frustrated and angry,2
3759,Jordan sent out invitations to the staff for the reception Jordan is having for their success.,How would you describe Jordan?,an uncaring and selfish person,a generous and appreciative person,the kind of person that wants people to fear him,2
3760,Kendall sold their old car and got a new one the next day.,How would Kendall feel afterwards?,impatient person,bored now,proud now,3
3761,Lindsay gave Kai a bag with his birthday present. Kai decided to open the bag.,How would you describe Kai?,impatient,a person that doesn't buy gifts for Lindsay,a person that knows Lindsay well,1
3762,alex left money behind for addison but addison lost it and couldn't pay their bills.,What will happen to Addison?,be unsatisfied with Addison,be broke,be angry,2
3763,carson wanted to show his appreciation so he took jordan's hand in his own.,What will Carson want to do next?,berate jordan,comfort jordan,ignore jordan,2
3764,Austin ran along the side of the car on the way to the store trying to get in.,What will Austin want to do next?,fall down,fall onto the street,get in the car,3
3765,"Quinn gave Bailey the best advice of her life, that she should vaccinate her children.",How would you describe Quinn?,trying to help Bailey,pleased,trying to hurt Bailey's children,1
3766,Robin was getting married to a very nice man that was in the military.,How would you describe Robin?,hateful,lonely,romantic,3
3767,Ash and Aubrey told their friends they were going to a different school soon.,What will Ash want to do next?,fall down and play dead,check out their new school,be liars,2
3768,austin was a cool guy so he never wore a hat.,Why did Austin do this?,look in the mirror,insult certain people,be a cool man,3
3769,Cameron is a name that rolled off the tongue while Cameron's classmates all had funny sounding names.,How would Others feel as a result?,didn't let people bother him,envious,a class clown,2
3770,Addison protected the public's interests by running for local office.,What will Addison want to do next?,vote for addison,fight bad actors,support addison,1
3771,Tracy finally went to the doctor after being sick for weeks with a cold.,What does Tracy need to do before this?,go to work before this,get medicine,be sick for weeks before this,3
3772,"Taylor asked another person to the dance, and yet another person said no.",What does Taylor need to do before this?,get up the courage to ask,ask another person to the dance,go to the dance with another person,1
3773,kai was a social person so he visited his friends.,How would you describe Kai?,social,anti social,unfriendly,1
3774,Skylar took Cameron to a shelter after finding out they'd been sleeping on the street.,What does Skylar need to do before this?,lay on a bed,sleep on a cot,know about the shelter,3
3775,Addison told Riley that he was a big fan of his skills on the guitar that he played.,How would Riley feel as a result?,a fan of Riley's guitar playing,fulfilled,angry,2
3776,Cameron want to go to the museum opening but had no money for the admittance.  Carson paid for Cameron's visit.,Carson did this for what reason?,be paid back,wanted to give Cameron anguish,wanted to make Cameron happy,3
3777,Robin baked cookies all day in her new bakery.,Why did Robin do this?,she hated cookies,she hated baking,enjoy her place,3
3778,Ash wasn't in the mood so he didn't catch anything.,How would Ash feel afterwards?,an unmotivated person,like a loser,an undisciplined person,1
3779,Aubrey educated their children on right and wrong so they would grow up well.,What will happen to Others?,get great mother's day gifts,be rich as their children become doctors,grow up well,3
3780,Jan was an artist who made sculptures for a living.,What does Jan need to do before this?,become a professional,learn how to sculpt,achieve their dreams,2
3781,Skylar went to the new house yesterday to check on Bailey.,What will happen to Bailey?,admire the clean house,ignore each other,go back home,1
3782,Carson liked to get drunk at the local bar and went there every Saturday.,What will Carson want to do next?,liked to get drunk at the bar,stop drinking so heavily and often,meet friends at the bar to talk to,2
3783,Robin left the restaurant without paying for her meal.,How would Robin feel afterwards?,very guilty,like a good person,a hero,1
3784,Austin gave Robin reason to smile and told Robin that they loved them.,Why did Austin do this?,make Robin resent them,express their love for Robin,scare Robin into leaving,2
3785,Kai got their ball after it was kicked far.,How would you describe Kai?,a team player,rude,Increase Your Back Swing. ...Leverage Your Body. ...Lock The Leg At Impact. ...Kick With Your Foot 'Bone',1
3786,"Jan played video games 10 hours in day, video games became really addictive and he lost his job.",What will Others want to do next?,take the video games away,Others will be happy and buy more games for Jan,Others will be exited because its a healthy addiction,1
3787,Riley told the person that what they said was incorrect.,How would you describe Riley?,helpful,a know-it-all person,bossy,2
3788,"Carson noticed the lady was smoking while holding the baby, so Carson pulled the baby away.",What will Carson want to do next?,Give the baby back,Ask for a cigarette,Leave with the baby,1
3789,Alex is so excited about the good news that he is bouncing off the walls with excitement.,How would you describe Alex?,so excited he couldn't hide it,sad,happy,1
3790,Carson took their shoes off before entering their friend's home after school that day.,Why did Carson take off their shoes?,walk into the house,be respectful of their friend,sneak into their friend's home,2
3791,Tracy thought they might want it so she shared it with the others at the party.,What will happen to Others?,be grateful,be disappointed,be annoyed,1
3792,Sasha decorated Aubrey's tree with many beautiful ornaments that were very shiny.,What will happen to Sasha?,happy,lazy,take a selfie with Sasha,1
3793,Carson examined Skylar's work carefully and gave them an A for a grade.,What does Carson need to do before this?,finish up,want to grade the work,keep grading papers,2
3794,Quinn made a lot of assumptions before finding out the truth.,What does Quinn need to do before this?,Revist things they thought they knew,be asleep,get informed,1
3795,Robin was forced upon Casey because she fell on him accidentally.,What will happen to Casey?,he will be comfy,apologize for it,he will be smushed,3
3796,Skylar wanted to do something nice and got his son a gift.,What will Others want to do next?,hug Skylar,hit Skylar,kick Skylar,1
3797,Addison checked Skyler's car for her phone whether it is there or not.,What does Addison need to do before this?,know Skylar's car's model,lose her phone somewhere,great,2
3798,Bailey saw a show and it inspired her to become a photographer.,How did Bailey become inspired?,quit her job,become a painter,she saw a show,3
3799,Taylor considered the capacity of the audience to see the magic trick he was doing on the stage.,What will Taylor want to do next?,run off stage,quit doing magic,make sure they can see,3
3800,Remy dated his girlfriend after spending a whole year asking her out.  Ramy´s girlfriend finally said yes and they have been together for two years now.,What does Remy need to do before this?,never ask her out,did this for love,make his girlfriedn fall in love,3
3801,Kendall had a party at Jordan's house but was found out to not have asked and just broke in.,How would Kendall feel afterwards?,guilty,thrilled,blessed,1
3802,Ash painted Jordan's picture and then had it framed for his birthday.,What will Ash want to do next?,give the gift,erase the picture,develop the film,1
3803,Kendall had to buy another one after her phone cable broke down.,What will Kendall want to do next?,wanted to have a working phone,wanted to replace the broken cable,go to the store,3
3804,Bailey tried another way on how to solve the hard math problem.,What will Bailey want to do next?,tried another how to solve the hard math,bored,smart,1
3805,Carson called to check their account and to tell them they had more money than was deposited.,How would Carson feel afterwards?,a careful person,shocked now,a responsible person,3
3806,"Due to her wanting to raise and pay for them, Sasha decided to save her mother's babies.",Why did Sasha save the babies?,wanted to raise the babies,wanted to pay for her mother,calm herself down,1
3807,Jordan pushed the envelope away from Skylar even though Jordan knew that Skylar was excited to read it.,How would you describe Jordan?,as selfish,like to tease Skylar,as mean,2
3808,"Taylor didn't have it himself, but he knew that he could get it from his friend.",What does Taylor need to do before this?,Go to his dresser,Go to his closet,Call his friend,3
3809,Kendall was playing football with their brother and passed them the ball.,Why did Kendall do this?,play football,talk to their brother,run after his brother,1
3810,Kai was involved in a fight with other students and walked away from school.,How would Kai feel afterwards?,afraid for her safety,strong willed,happy or elated,2
3811,carson liked to help jordan so he pulled some lint from jordan's pockets.,What will Jordan want to do next?,hate carson,thank carson,clean Jordan's pockets,2
3812,Jordan got very drunk and couldn't manage to stand up straight.,How would Jordan feel afterwards?,like throwing up,pathetic,weak,1
3813,Ash got the job at the bank that he applied for a week ago.,What will happen to Ash?,steal money from the bank,try hard at their job,quit their job right away,2
3814,Alex had a party at her house with all her friends to celebrate their 18th birthday.,How would you describe Alex?,able to drink beer,getting very old,an adult now,3
3815,Sasha was playing on the monkey bars and broke her leg after falling down.,What will Sasha want to do next?,climb the monkey bars,Call her parents,go to the playground,2
3816,Carson made lots of friends when they went to the club last night.,What will Carson want to do next?,spend time with others,not talk to anyone,avoid others,1
3817,"After months of crooked teeth and painful chewing, Tracy finally got braces today.",What does Tracy need to do before this?,make an appointment with the teacher,practice brushing her teeth,have their teeth checked for a proper fit,3
3818,Ash was diagnosed with diabetes because she ate too much sweets.,What will Ash want to do next?,avoid medication,eat healthy food,hate healthy food,2
3819,Ash was in charge of a presentation at work but was running behind schedule.,What will Others want to do next?,stall the meeting,relax and not worry,hurry up,1
3820,Taylor pressed Skylar's hands on the table to stop them from getting away.,Why did Taylor do this?,tell Skylar to stay there,subdue Skylar,hold hands with Skylar,2
3821,Sebastian was applying to nursing school and asked Lee for a recommendation letter.,What did Sebastian need to do before this?,finish the nursing prerequisites,give Lee a job interview,finish going to medical school,1
3822,"Aubrey has the day off of work today, and is currently spending her time watching TV in her living room.",How would Aubrey feel afterwards?,anxious,relaxed,energetic,2
3823,"He felt like he should stand his ground, but eventually Ash complied with Jesse's request.",What will happen to Ash?,bad that he didn't stand up for what he believed in,be the leader,be proud that he caved so quickly,1
3824,Alex served as Lee's apprentice at Lee's family owned car repair show.,What does Alex need to do before this?,quit their job,graduate college,want to learn about cars,3
3825,Remy carried out Addison's work plans and the plan resulted in them becoming rich.,How would Addison feel as a result?,lazy,conflicted,happy,3
3826,addison wanted to be nice to his grandma so he paid her rent for her.,How would Others feel as a result?,uncaring,a generous person,thankful,3
3827,Bailey wasn't sure where the thief ran off to. Bailey went around the corner to see.,How would you describe Bailey as a person?,scared and angry,upset and mad,a concerned person,3
3828,Jan went to Skylar's room and asked them if they were okay.,Why did Jan do this?,go away on their own,be rude to their friend,show they cared,3
3829,Jesse got egg on their face from the food fight which was a great time for everyone.,What will Others want to do next?,stop the madness,scold Jesse,have fun,3
3830,Addison put Jesse's hand on Jesse's hips and showed her the steps of the dance.,What will Jesse want to do next?,watch television next,teach her the proper steps,learn the dance next,3
3831,Ash was the class clown and was always playing tricks on his teachers.,What will Others want to do next?,look away,tell him to stop,have a good time,2
3832,Jan made the same thing as Riley did for their project in art class.,Why did Jan do this?,want Riley to do the project,give out a project,liked what Riley did,3
